Mini Wireless Bluetooth Earbuds,8.21,Compacte TWS-oortjes met ruisonderdrukking en oplaadcase,Elektronica,https://i.imgur.com/4QfKq6F.jpeg,https://i.imgur.com/7m2YbqF.jpeg,,SoundPeak Store,32
LED Strip Light RGB 5m,6.44,Flexibele RGB-lichtstrip met afstandsbediening,Smart Home,https://i.imgur.com/8yq2p9M.jpeg,,,HomeGlow Official,18
Silicone AirPods Case Cover,1.92,Schokbestendige siliconen hoes voor AirPods 1/2,Accessoires,https://i.imgur.com/3xqk0tA.jpeg,,,CaseWorld,12
USB-C Fast Charging Cable 1m,2.11,Snellaadkabel geschikt voor Android en iPad,Elektronica,https://i.imgur.com/6z8tYpS.jpeg,,,TechLine,25
Stainless Steel Kitchen Peeler,3.08,Duurzame dunschiller met ergonomische grip,Keuken,https://i.imgur.com/9m4kz1D.jpeg,,,CookMaster,10
Waterproof Fitness Smartwatch,14.77,Activity tracker met hartslagmeter en slaapmonitor,Elektronica,https://i.imgur.com/2q8uQnE.jpeg,https://i.imgur.com/5p7uYwF.jpeg,,FitPro Store,40
Portable Mini Blender USB,11.33,Draagbare smoothie-blender met 6 messen,Keuken,https://i.imgur.com/1yq8t9G.jpeg,,,FreshBlend,22
Foldable Laptop Stand Aluminum,7.89,Verstelbare laptopstandaard voor ergonomisch werken,Kantoor,https://i.imgur.com/8kq1t7H.jpeg,,,OfficePro,15
Anti-Slip Yoga Mat 6mm,12.55,Comfortabele yogamat met antislip-textuur,Sport,https://i.imgur.com/4p9t2kL.jpeg,,,ZenSport,28
Magnetic Phone Car Holder,3.66,Universele magnetische telefoonhouder voor auto,Auto,https://i.imgur.com/7qk1p8D.jpeg,,,DriveTech,20
Rechargeable LED Camping Lantern,9.44,Heldere outdoor-lamp met USB-oplaadfunctie,Outdoor,https://i.imgur.com/2m8k0sP.jpeg,,,CampBright,35
Stainless Steel Water Bottle 500ml,5.22,Dubbelwandige thermosfles voor warme/koude dranken,Outdoor,https://i.imgur.com/9p7t4wQ.jpeg,,,AquaSteel,14
Electric Hair Trimmer USB,8.99,Professionele tondeuse met meerdere opzetkammen,Beauty,https://i.imgur.com/6yq1t0F.jpeg,,,GroomPro,30
Silicone Cooking Utensils Set,10.33,Hittebestendige keukenhulpen met houten handvat,Keuken,https://i.imgur.com/3p9t7kS.jpeg,,,KitchenLeaf,18
Wireless Charging Pad 15W,6.77,Snelle Qi-oplader voor iPhone en Android,Elektronica,https://i.imgur.com/5q8t1nE.jpeg,,,ChargeBase,27
Pet Grooming Brush,4.12,Zelfreinigende borstel voor honden en katten,Huisdieren,https://i.imgur.com/7p9t3kL.jpeg,,,PetCare,12
Smart LED Light Bulb E27 RGB,4.88,App-gestuurde slimme lamp met kleurenmodus,Smart Home,https://i.imgur.com/1q8t9pM.jpeg,,,BrightHome,33
Car Scratch Repair Pen,2.99,Snelle oplossing voor kleine lakschades,Auto,https://i.imgur.com/8p7t1wN.jpeg,,,AutoFix,10
USB Desk Fan Mini,4.55,Compacte stille bureauventilator,Kantoor,https://i.imgur.com/9q8t2kB.jpeg,,,CoolBreeze,22
Waterproof Phone Pouch,2.44,Waterdichte hoes voor strand en zwembad,Outdoor,https://i.imgur.com/3m7t1pC.jpeg,,,AquaSafe,15
Adjustable Resistance Fitness Bands,7.22,Elastische trainingsbanden met verschillende weerstandsniveaus,Sport,https://i.imgur.com/8gk1pQF.jpeg,,,FlexFit Store,26
USB Rechargeable Bike Headlight,5.88,Krachtige LED-fietsverlichting met meerdere standen,Outdoor,https://i.imgur.com/4tq9m2L.jpeg,,,CycleBright,18
Anti-Blue Light Computer Glasses,3.77,Bril die schadelijk blauw licht filtert,Kantoor,https://i.imgur.com/7p1kq8S.jpeg,,,VisionGuard,12
Portable Electric Lint Remover,4.99,Pluizenverwijderaar voor kleding en meubels,Home,https://i.imgur.com/9yq2t7D.jpeg,,,CleanEase,20
Smart WiFi Plug EU,6.11,Slimme stekker met app-bediening en timerfunctie,Smart Home,https://i.imgur.com/3k8t1pE.jpeg,,,HomeSync,30
Stainless Steel Garlic Press,3.44,Stevige knoflookpers met ergonomisch handvat,Keuken,https://i.imgur.com/6p9t3kM.jpeg,,,ChefTools,14
Wireless Mouse Silent Click,5.66,Ergonomische stille muis met 2.4G-verbinding,Kantoor,https://i.imgur.com/1q7t9pB.jpeg,,,ClickSoft,22
Car USB Dual Fast Charger,2.55,Snelle autolader met dubbele USB-poort,Auto,https://i.imgur.com/8m1t7wQ.jpeg,,,DriveCharge,18
Reusable Silicone Food Bags,6.33,Herbruikbare luchtdichte zakken voor voedselopslag,Keuken,https://i.imgur.com/5p9t3kH.jpeg,,,EcoKitchen,25
Foldable Shopping Tote Bag,2.22,Opvouwbare boodschappentas van stevig nylon,Lifestyle,https://i.imgur.com/3yq1t8L.jpeg,,,DailyCarry,10
Waterproof LED Dog Collar,4.44,Verlichte halsband voor extra zichtbaarheid,Huisdieren,https://i.imgur.com/7p8t2kF.jpeg,,,PetGlow,28
Mini Desktop Vacuum Cleaner,6.99,Kleine USB-stofzuiger voor toetsenborden,Kantoor,https://i.imgur.com/9q1t7pC.jpeg,,,DeskClean,22
Heat-Resistant BBQ Gloves,7.55,Hittebestendige handschoenen voor grillen,Outdoor,https://i.imgur.com/4k9t3wM.jpeg,,,GrillMaster,30
Magnetic Cable Organizer,3.11,Magnetisch kabelbeheer voor bureau,Accessoires,https://i.imgur.com/1p8t9kS.jpeg,,,NeatLine,15
Electric Facial Cleansing Brush,8.22,Siliconen gezichtsreiniger met vibratie,Beauty,https://i.imgur.com/6q7t1pE.jpeg,,,GlowSkin,35
Universal TV Remote Control,3.77,Compatibel met de meeste tv-merken,Elektronica,https://i.imgur.com/8p9t3kL.jpeg,,,MediaControl,12
Stainless Steel Reusable Straw Set,2.88,Set van metalen rietjes met schoonmaakborstel,Lifestyle,https://i.imgur.com/3q7t1pN.jpeg,,,EcoSip,18
Car Trunk Organizer Foldable,9.11,Opvouwbare kofferbak-organizer met vakken,Auto,https://i.imgur.com/5m9t3kB.jpeg,,,AutoStore,25
USB Rechargeable Hand Warmer,7.44,Herbruikbare handwarmer met twee standen,Outdoor,https://i.imgur.com/7q1t8pF.jpeg,,,WarmPocket,20
LED Makeup Mirror with Touch Control,10.55,Verlichte make-up spiegel met touch-bediening,Beauty,https://i.imgur.com/9p7t3kE.jpeg,,,GlamLite,32
USB Rechargeable Milk Frother,5.88,Elektrische melkopschuimer met garde,Keuken,https://i.imgur.com/4t9kq2F.jpeg,,,FoamMaster,22
Waterproof Travel Toiletry Bag,6.44,Opvouwbare toilettas met vakken,Lifestyle,https://i.imgur.com/7p1t8kM.jpeg,,,TravelEase,18
LED Motion Sensor Night Light,4.33,Automatische nachtlamp voor gangen,Smart Home,https://i.imgur.com/9q7t1pE.jpeg,,,GlowSense,30
Silicone Heat-Resistant Oven Mat,3.99,Herbruikbare bakmat voor oven,Keuken,https://i.imgur.com/3p8t9kL.jpeg,,,BakePro,12
Wireless Keyboard Compact,11.22,Stil compact toetsenbord,Kantoor,https://i.imgur.com/6q1t7pB.jpeg,,,KeyFlow,28
Car Windshield Sun Shade,5.55,Opvouwbaar zonnescherm voor auto,Auto,https://i.imgur.com/8m9t3kS.jpeg,,,AutoShield,20
Stainless Steel Manual Coffee Grinder,12.88,Handmatige koffiemolen met keramische schijf,Keuken,https://i.imgur.com/1q8t7pN.jpeg,,,BrewCraft,25
Foldable Silicone Pet Bowl,2.66,Opvouwbare voerbak voor huisdieren,Huisdieren,https://i.imgur.com/5p7t1kE.jpeg,,,PetTravel,10
USB LED Book Reading Light,3.44,Flexibele leeslamp met clip,Lifestyle,https://i.imgur.com/7q9t3wF.jpeg,,,LightLeaf,18
Anti-Slip Bathroom Shower Mat,6.11,Veiligheidsmat met zuignappen,Home,https://i.imgur.com/9p1t8kC.jpeg,,,SafeHome,22
Rechargeable Electric Wine Opener,10.77,Automatische kurkentrekker met USB-opladen,Keuken,https://i.imgur.com/4k8t9pM.jpeg,,,VinoTech,30
Smart Digital Thermometer,4.88,Snelle thermometer voor keuken en grill,Keuken,https://i.imgur.com/2p9t3kL.jpeg,,,HeatCheck,15
Wireless Doorbell Waterproof,8.44,Draadloze deurbel met meerdere tonen,Smart Home,https://i.imgur.com/6q7t1pE.jpeg,,,RingLite,28
Portable Neck Fan USB,9.33,Handsfree nekventilator met dubbele luchtstroom,Lifestyle,https://i.imgur.com/8p1t9kS.jpeg,,,CoolWear,22
Car Seat Gap Storage Box,7.66,Organizer voor tussen autostoel en console,Auto,https://i.imgur.com/3q9t3wN.jpeg,,,DriveStore,18
Stainless Steel Insulated Lunch Box,11.99,Lekvrije thermische lunchbox,Keuken,https://i.imgur.com/5m7t1pB.jpeg,,,FreshBox,25
LED Strip Motion Sensor Cabinet Light,6.77,Automatische kastverlichting,Smart Home,https://i.imgur.com/7p8t9kF.jpeg,,,LightSense,30
Pet Slow Feeder Bowl,4.22,Anti-schrok voerbak,Huisdieren,https://i.imgur.com/9q1t7pE.jpeg,,,PetBalance,12
USB Rechargeable Mini Hair Straightener,8.88,Draagbare stijltang,Beauty,https://i.imgur.com/4p9t3kL.jpeg,,,StylePro,35
Foldable Picnic Blanket Waterproof,9.55,Waterdicht picknickkleed,Outdoor,https://i.imgur.com/1m8t9pC.jpeg,,,NatureEase,20
DIY Leather Craft Punch Set,6.88,Set met metalen ponsen voor leerbewerking,Hobby & DIY,https://i.imgur.com/4t9kq2F.jpeg,,,CraftForge,22
Minimalist Gold Hoop Earrings,3.44,Oorbellen van roestvrij staal,Fashion,https://i.imgur.com/7p1t8kM.jpeg,,,ShineStudio,15
Portable Digital Luggage Scale,5.22,Bagageweegschaal voor reizen,Travel,https://i.imgur.com/9q7t1pE.jpeg,,,TravelTech,20
LED Plant Grow Light Clip-On,9.99,Kweeklamp voor kamerplanten,Home & Garden,https://i.imgur.com/3p8t9kL.jpeg,,,GreenGlow,28
Stainless Steel Bartender Kit,12.77,Cocktailset met shaker,Keuken,https://i.imgur.com/6q1t7pB.jpeg,,,MixologyPro,25
Anti-Theft Crossbody Sling Bag,11.44,Waterdichte slingbag met verborgen ritsen,Lifestyle,https://i.imgur.com/8m9t3kS.jpeg,,,UrbanCarry,30
Rechargeable Electric Callus Remover,7.66,Voetverzorger met roterende kop,Beauty,https://i.imgur.com/1q8t7pN.jpeg,,,SoftFeet,22
Magnetic Building Blocks Kids Set,14.55,Educatieve magnetische bouwstenen,Kids & Toys,https://i.imgur.com/5p7t1kE.jpeg,,,PlayMag,35
Stainless Steel Wall-Mounted Spice Rack,8.33,Kruidenrek voor wandmontage,Home,https://i.imgur.com/7q9t3wF.jpeg,,,HomeCraft,18
USB Rechargeable LED Bike Wheel Lights,6.22,Kleurrijke wielverlichting,Outdoor,https://i.imgur.com/9p1t8kC.jpeg,,,CycleGlow,25
Mini Thermal Label Printer,18.44,Draagbare labelprinter,Kantoor,https://i.imgur.com/4k8t9pM.jpeg,,,LabelMate,32
Handmade Macramé Wall Hanging,7.55,Boho wanddecoratie,Home Decor,https://i.imgur.com/2p9t3kL.jpeg,,,DecoWeave,15
Stainless Steel Fishing Pliers,6.99,Multifunctionele visgereedschapstang,Sport & Outdoor,https://i.imgur.com/6q7t1pE.jpeg,,,FishPro,22
Portable Jewelry Storage Box,5.44,Compact sieradendoosje,Fashion Accessories,https://i.imgur.com/8p1t9kS.jpeg,,,JewelNest,12
USB Rechargeable Mini Air Pump,9.22,Elektrische pomp voor luchtbedden,Outdoor,https://i.imgur.com/3q9t3wN.jpeg,,,AirLite,28
Silicone Reusable Baking Cups,3.66,Herbruikbare cupcakevormpjes,Keuken,https://i.imgur.com/5m7t1pB.jpeg,,,BakeLeaf,10
Smart Bluetooth Key Finder,4.88,Tracker voor sleutels en tassen,Elektronica,https://i.imgur.com/7p8t9kF.jpeg,,,FindMe,22
Pet Cooling Mat Gel-Filled,10.11,Zelfkoelende mat voor huisdieren,Huisdieren,https://i.imgur.com/9q1t7pE.jpeg,,,CoolPet,30
Stainless Steel Precision Screwdriver Kit,8.77,24-in-1 schroevendraaierset,Tools,https://i.imgur.com/4p9t3kL.jpeg,,,FixItLab,25
Foldable Travel Shoe Organizer,6.33,Opvouwbare tas voor schoenen,Travel,https://i.imgur.com/1m8t9pC.jpeg,,,PackSmart,18
Mini USB Soldering Iron,7.88,Compacte soldeerbout,Tools,https://i.imgur.com/4t9kq2F.jpeg,,,FixLab,22
Foldable Travel Cutlery Set,3.66,Herbruikbare bestekset,Travel,https://i.imgur.com/7p1t8kM.jpeg,,,PackLite,12
Smart LED Alarm Clock,9.55,Digitale klok met temperatuur,Home,https://i.imgur.com/9q7t1pE.jpeg,,,TimeGlow,28
Stainless Steel Reusable Water Filter,6.22,Herbruikbare waterfilter,Keuken,https://i.imgur.com/3p8t9kL.jpeg,,,PureFlow,18
Anti-Slip Car Steering Wheel Cover,4.44,Comfortabele stuurhoes,Auto,https://i.imgur.com/6q1t7pB.jpeg,,,DriveGrip,20
Wireless Bluetooth Sleep Mask,8.77,Slaapmasker met speakers,Lifestyle,https://i.imgur.com/8m9t3kS.jpeg,,,DreamWave,30
Kids Wooden Puzzle Animals,5.11,Houten dierenpuzzel,Kids & Toys,https://i.imgur.com/1q8t7pN.jpeg,,,TinyWood,15
USB Rechargeable Handheld Vacuum,12.44,Mini-stofzuiger,Home,https://i.imgur.com/5p7t1kE.jpeg,,,CleanJet,25
Stainless Steel Bento Box,10.33,Lekvrije lunchbox,Keuken,https://i.imgur.com/7q9t3wF.jpeg,,,BentoCraft,22
LED USB Star Projector,9.99,Projector met sterren,Home Decor,https://i.imgur.com/9p1t8kC.jpeg,,,StarLite,30
Waterproof Hiking Gaiters,7.66,Beschermhoezen voor wandelen,Outdoor,https://i.imgur.com/4k8t9pM.jpeg,,,TrailGuard,18
Mini Portable Sewing Machine,11.88,Handnaaimachine,Hobby & DIY,https://i.imgur.com/2p9